{
  "schema_version": "release-bundle.v1",
  "release_id": "release_0123456789abcdef",
  "prepared_at": "2026-07-14T03:00:00Z",
  "operation": "prepare_only",
  "program_ref": "content_program_0123456789abcdef",
  "items": [
    {
      "release_item_id": "release_item_x",
      "artifact": {
        "ref": "artifact://post/one",
        "schema_version": "post-v1",
        "content_hash": "sha256:aaaaaaaaaaaaaaaaaaaaaaaaaaaaaaaaaaaaaaaaaaaaaaaaaaaaaaaaaaaaaaaa",
        "publication_state": "ready",
        "selected_variant": "x"
      },
      "platform": "x",
      "account_ref": "account:x:main",
      "execution_mode": "manual_handoff",
      "capability": {
        "status": "unverified",
        "checked_at": null,
        "official_source_url": null,
        "adapter_id": null,
        "supports": {
          "create": false,
          "draft": false,
          "schedule": false,
          "edit": false,
          "delete": false,
          "status": false
        }
      },
      "policy": {
        "decision": "ready",
        "checked_at": "2026-07-14T02:00:00Z",
        "source_urls": [
          "https://docs.x.com/x-api/posts/create-post"
        ],
        "notes": "Current platform policy checked."
      },
      "approvals": {
        "content": {
          "status": "approved",
          "approved_by": "user:owner",
          "approved_at": "2026-07-14T03:01:00Z"
        },
        "release": {
          "status": "approved",
          "approved_by": "user:owner",
          "approved_at": "2026-07-14T03:02:00Z"
        }
      },
      "schedule": {
        "publish_at": null,
        "timezone": null,
        "embargo_until": null,
        "expires_at": null
      },
      "payload": {
        "payload_hash": "sha256:bbbbbbbbbbbbbbbbbbbbbbbbbbbbbbbbbbbbbbbbbbbbbbbbbbbbbbbbbbbbbbbb",
        "preview_ref": "preview://post/one",
        "asset_refs": []
      },
      "depends_on": [],
      "idempotency_key": null,
      "manual_handoff": {
        "required": true,
        "handoff_ref": "handoff://post/one",
        "checklist": [
          "Open the final preview.",
          "Confirm the account and visible disclosures."
        ]
      },
      "rollback": {
        "mode": "manual",
        "edit_supported": true,
        "delete_supported": true,
        "notes": "Use the native platform controls."
      },
      "preflight": {
        "status": "pass",
        "checks": [
          "Final payload frozen."
        ],
        "repairs": []
      }
    }
  ],
  "quality_report": {
    "scores": {},
    "hard_failures": [],
    "revisions": []
  },
  "release_state": "ready"
}

